{
  "id": "piaget_cognitive_stages",
  "name_zh": "认知发展阶段理论",
  "name_en": "Theory of Cognitive Development",
  "scholar": "Jean Piaget (1952)",
  "year": 1952,
  "school": "发生认识论 / 建构主义",
  "summary": "Piaget 认为儿童的认知发展经历四个有顺序、不可逾越的阶段：感知运动期（0-2 岁）、前运算期（2-7 岁）、具体运算期（7-11 岁）、形式运算期（11 岁以后）。每个阶段都有特定的思维结构与局限，决定了儿童能理解什么、不能理解什么。教学必须匹配学习者所处阶段：对具体运算期的学生讲抽象代数符号，他们听到的只是噪音；对形式运算期的学生反复用具体例子，会被认为啰嗦。EchoClass 中此理论是学段（stage_id）划分的认知边界依据。",
  "traits": {
    "preoperational": {
      "label": "前运算期（2-7 岁，对应 P1 早期）",
      "operational_rules": [
        "倾向于自我中心式表达，描述事物时假定老师已经看到了'我看到的画面'，常省略关键背景，例如指着插图说'这个'而不说'这道题里的小明'",
        "无法可逆思考——理解了 3+2=5 之后并不会自动接受 5-2=3，需要通过实物操作单独建立",
        "会被知觉表面特征绑架：把同样多但摆得分散的小棒看成'更多'；把高瘦杯子的水看成比矮胖杯子里更多",
        "解释现象时使用泛灵论或拟人化（'乌云生气了所以下雨''数字 0 觉得寂寞'），需要老师肯定想象力同时引回数学事实",
        "注意力以兴趣驱动而非任务驱动，老师讲 30 秒还没切到他感兴趣的部分就会神游",
        "用语言描述抽象关系几乎不可能，需要老师把抽象概念翻译为可触摸物体、可表演动作或绘画"
      ]
    },
    "concrete_operational": {
      "label": "具体运算期（7-11 岁，对应 P2-P6 主体）",
      "operational_rules": [
        "能进行可逆运算和守恒判断，但只对'眼前能想象到的具体情境'有效：分蛋糕、装苹果、量绳子可以；纯抽象代数符号会卡住",
        "能分类与序列化，但要求老师先给出几个例子让他归纳，而不是先丢一个抽象定义再让他套用",
        "面对无具体情境的'设 x 为某未知数'之类问法，会愣住或问'x 是几啊'，需要老师把符号即时翻译回'就是那个我们要找的数'",
        "能够进行多步推理，但每一步都需要在具体场景中可验证；超过 3-4 步且每步抽象会逐渐失焦",
        "对反例和守恒类提问反应良好，对纯演绎'如果 A 则 B'类假设性问题反应慢，需要老师改写成'假如咱们班有 30 个人……'这种具体框架",
        "已能区分'可能''一定''不可能'，但对'当且仅当''任意''存在'等量词仍混淆，需要老师用具体例子拆解"
      ]
    },
    "formal_operational": {
      "label": "形式运算期（11 岁以后，对应 J3 及高中）",
      "operational_rules": [
        "能够脱离具体情境进行假设演绎推理：'假如 a < 0，那么…'这类纯符号推演可以独立完成，无需老师每次给具体数字",
        "能系统地变量分离做思想实验（'如果保持 b 不变只让 a 变，会发生什么'），是物理化学应用题的认知前提",
        "对老师的过度具象化解释会感到不耐烦，认为'已经讲过例子了请进入抽象'，更喜欢看到一般化的公式或证明",
        "开始能反思自己的思维过程（元认知），会主动问'我刚才那个推理是不是循环论证''这个证明是充分条件还是必要条件'",
        "能接受反直觉但逻辑自洽的结论（如负负得正、0.999... = 1），不再因'感觉怪怪的'而本能拒绝，但仍会要求严格证明",
        "面对开放性问题倾向于先穷举可能性再筛选，而非具体运算期的'直接试一个看看'"
      ]
    }
  },
  "applies_to": {
    "persona": true,
    "misconception": true,
    "rubric": false
  },
  "references": [
    "Piaget, J. (1952). The Origins of Intelligence in Children (M. Cook, Trans.). New York: International Universities Press.",
    "Piaget, J., & Inhelder, B. (1969). The Psychology of the Child (H. Weaver, Trans.). New York: Basic Books.",
    "皮亚杰. (1981). 发生认识论原理 (王宪钿 等译). 北京: 商务印书馆.",
    "林崇德. (2009). 发展心理学 (第二版). 北京: 人民教育出版社, 第 4 章."
  ]
}
