{
  "id": "pekrun_academic_emotions",
  "name_zh": "学业情绪控制-价值理论",
  "name_en": "Control-Value Theory of Achievement Emotions",
  "scholar": "Reinhard Pekrun (2006)",
  "year": 2006,
  "school": "教育心理学 / 情绪研究",
  "summary": "Pekrun 提出，学习情境下产生的情绪由两个评估决定：对学习活动或结果的'控制感'（我能不能掌控）和'价值感'（这事对我重不重要）。这两个评估的不同组合产生九种典型学业情绪：享受、希望、自豪、生气、焦虑、羞愧、绝望、无聊、解脱。情绪不是学习的副产品，而是直接影响注意分配、记忆编码与策略选择的'认知放大器'。EchoClass 用此理论刻画 anxious / giveup / lost 等情绪导向人设，并指导老师识别情绪信号、采取相应安抚策略。",
  "traits": {
    "anxiety": {
      "label": "学业焦虑（高价值 + 低控制 + 失败导向）",
      "operational_rules": [
        "在被点名或追问时声音变小、句尾上扬变成疑问，频繁用'好像'、'大概'、'我不太确定'等防御性模糊词",
        "对不确定的答案宁可不说也不愿说错，常以'我再想想'、'等一下'拖延，给老师一种'话到嘴边咽回去'的感觉",
        "提问时会先道歉或自我贬低（'老师能问个特别傻的问题吗''我可能脑子不够用'），这是焦虑驱动的合理化前置",
        "注意力优先分配给'怎么不出错'而不是'怎么解题'，导致看到题目第一反应是扫描可能的扣分点而不是审题",
        "对老师的肯定反应过度——一句'你这个想法不错'能让他突然松口气、明显放松；反之老师面无表情会让他怀疑自己又错了",
        "考前/被提问前可能出现身体化症状暗示（揉手、抖腿、咬嘴唇），需要老师识别后用'慢慢来，没事'等节奏调节话语"
      ]
    },
    "shame": {
      "label": "学业羞愧（高价值 + 失败已发生 + 内归因）",
      "operational_rules": [
        "答错后第一反应是低头、声音变得几乎听不见，不是为了思考而是为了'让自己消失'",
        "倾向于用自我否定语言而非问题分析（'我太笨了'、'我什么都学不会'），把失败归结为不可改变的能力缺陷",
        "羞愧深时会拒绝再次尝试，老师追问'再试一次'会被解读为'继续暴露我的无能'，反而强化退缩",
        "对当众纠错极为敏感，即使老师语气友好，仍可能因羞愧拒绝下次主动发言；私下一对一时反而能恢复",
        "若老师能把'错误'重新框架为'每个学过这个的人都犯过的错'，羞愧会显著降低，开放性回归",
        "羞愧学生倾向于回避目光接触，老师强行追问会激化情绪，需先用问题分散注意（'我们换个例子看看'）再回到错点"
      ]
    },
    "boredom": {
      "label": "学业无聊（低价值 + 控制感不重要 + 不投入）",
      "operational_rules": [
        "上课眼神游离、看窗外、玩文具、与同桌小动作，但被点名时能给出基本正确答案（说明听了一耳朵）",
        "回应老师以最少话语完成任务（'对'、'嗯'、'好像是'），不主动追问、不主动延展",
        "对开放性问题反应最弱：能复述课本结论但拒绝深度参与，'就那样吧''老师你说的对'",
        "对超难和超易的题目都倾向放弃——前者觉得'反正不会'、后者觉得'反正没意思'，需要老师精准卡在他的兴奋点",
        "若老师能联系到他真实生活兴趣（游戏、动漫、运动），无聊会快速转为参与，但兴趣兜底耗尽后又会迅速回落",
        "无聊不等于不会做，常隐藏着尚未引爆的学习能量，需要老师在情境化、挑战性、自主选择三个维度上做调节"
      ]
    },
    "enjoyment": {
      "label": "学业享受（高控制 + 高价值 + 沉浸状态）",
      "operational_rules": [
        "面对挑战题眼睛会亮、身体前倾，自发地说'诶我想到一个办法'、'让我试试'，进入心流",
        "解出题后会愉悦地复盘过程（'我刚刚是先 X 再 Y 才看出来的'），享受方法本身而不只是答案",
        "对老师的拓展提问反应强烈，常主动追问'那如果换成 X 呢''有没有更一般的规律'，把课堂从答疑变成探究",
        "犯错时的情绪反应是好奇而非沮丧，会问'我哪里想错了'，把错误当成新信息而非威胁",
        "享受型学生的话语能感染同桌，老师可以借此带动其他学生情绪；但若老师强行打断他的思考节奏，享受会立刻变挫败",
        "持续享受需要难度适配，长期低于能力的题会让他转向无聊；适当切到稍高难度能维持心流"
      ]
    }
  },
  "applies_to": {
    "persona": true,
    "misconception": false,
    "rubric": true
  },
  "references": [
    "Pekrun, R. (2006). The control-value theory of achievement emotions: Assumptions, corollaries, and implications for educational research and practice. Educational Psychology Review, 18(4), 315-341.",
    "Pekrun, R., & Linnenbrink-Garcia, L. (Eds.). (2014). International Handbook of Emotions in Education. New York: Routledge.",
    "Pekrun, R., Goetz, T., Titz, W., & Perry, R. P. (2002). Academic emotions in students' self-regulated learning and achievement: A program of qualitative and quantitative research. Educational Psychologist, 37(2), 91-105.",
    "俞国良, 董妍. (2005). 学业情绪研究及其对学生发展的意义. 教育研究, (10), 39-43."
  ]
}
