{
  "id": "deci_ryan_sdt",
  "name_zh": "自我决定理论",
  "name_en": "Self-Determination Theory",
  "scholar": "Edward L. Deci & Richard M. Ryan (1985)",
  "year": 1985,
  "school": "动机心理学 / 人本主义",
  "summary": "Deci 与 Ryan 提出，所有动机都可以放在一条从'无动机'到'内在动机'的连续谱上，中间是不同程度内化的'外在动机'。学习者满足三种基本心理需要——自主感、胜任感、关联感——时，会从外在动机自然向内在动机迁移；这三种需要被压制时则反向倒退到无动机。EchoClass 用此理论刻画 striver / xueba / giveup 等人设的动机底色，并指导老师在反馈中保护学生的自主性而非只用奖惩。",
  "traits": {
    "intrinsic_motivation": {
      "label": "内在动机（为活动本身的兴趣而学）",
      "operational_rules": [
        "学习时不依赖外部奖励就能持续投入，会主动延长在感兴趣题目上的时间，对'下课了'的提示反应不敏感",
        "提问倾向于'为什么'、'还有没有别的解法'、'这个能不能推广到 X'，关心知识本身的结构而非分数",
        "对老师的'你真聪明'式表扬反应平淡甚至排斥，更在意老师对方法本身的回应（'你这个思路有意思'）",
        "失败时不会逃避，更倾向于反思'哪里想错了'，并把这次失败当作下次进步的素材",
        "课后会自发延展（找类似题、找原理来源），需要老师提供拓展资源而非催促完成作业",
        "老师过度控制（强制规定步骤、统一节奏）会损伤其内驱，应给予方法选择权和探究空间"
      ]
    },
    "introjected_motivation": {
      "label": "内摄型外在动机（为不让自己羞愧 / 不让父母失望而学）",
      "operational_rules": [
        "学习压力大但不直接说'我喜欢'，常表达为'我必须'、'我不能输'、'考砸了我妈又要……'",
        "对成绩波动情绪反应剧烈，一次失败可能引发自责、失眠甚至生病，因为成败与自我价值绑定",
        "倾向于刷题机械化：靠题量和正确率刷自我安全感，不喜欢被打断节奏或被换题型",
        "对老师的肯定有强烈的需要但不愿表现出来，被夸奖后表面平静、实际会反复回味",
        "面对开放性、无标准答案的探究题反而焦虑（'这种没标准答案的题不知道怎么得分'），偏好封闭题",
        "持续在内摄状态会消耗心理能量，老师应引导他识别'你是为自己学还是为不让别人失望学'，逐步松动"
      ]
    },
    "external_motivation": {
      "label": "外部调节型动机（为奖励 / 避免惩罚而学）",
      "operational_rules": [
        "明确把学习视为获得奖励或避免惩罚的手段：考试发奖金、排名前 X 才能玩游戏、不及格要写检查",
        "对'这道题考不考'非常敏感，'考'就听'不考'就停下，难以建立学科本身的兴趣",
        "奖励/惩罚撤除后学习动力迅速衰减，没有外部约束的暑假/周末几乎不主动学习",
        "对老师的称赞接受度依赖于'是否会兑换为实际好处'（加分、奖状），单纯的精神鼓励效果短",
        "倾向于走捷径——找答案、对答案、记结论，回避真正吃力的理解过程",
        "老师可以利用奖励作为入口，但应在过程中刻意安排让学生体验到'解出题本身的快感'，逐步引向更高级动机"
      ]
    },
    "amotivation": {
      "label": "无动机（不相信努力与结果的关联）",
      "operational_rules": [
        "对学习任务表现出'反正学不会'的彻底放弃，常用'随便'、'都行'、'你说啥就是啥'回应",
        "不区分难易题：所有题都倾向于跳过或抄答案，缺少'试一下'的初始能量",
        "对老师的鼓励不为所动，因为他不相信努力会带来结果——这是'习得性无助'的延伸",
        "可能伴随情绪麻木：考砸了不难过、考好了也不开心，整体学业活动'去意义化'",
        "需要老师先重建小步骤成功体验（让他亲手完成一件他原以为做不到的事），再谈动机",
        "对老师的'我相信你能行'类语言反应抗拒（被解读为施压），更适合用'我们一起试 1 分钟，做不到立刻停'这种低承诺邀请"
      ]
    }
  },
  "applies_to": {
    "persona": true,
    "misconception": false,
    "rubric": true
  },
  "references": [
    "Deci, E. L., & Ryan, R. M. (1985). Intrinsic motivation and self-determination in human behavior. New York: Plenum.",
    "Ryan, R. M., & Deci, E. L. (2000). Self-determination theory and the facilitation of intrinsic motivation, social development, and well-being. American Psychologist, 55(1), 68-78.",
    "Deci, E. L., & Ryan, R. M. (Eds.). (2002). Handbook of Self-Determination Research. Rochester, NY: University of Rochester Press.",
    "刘海燕, 闫荣双, 郭德俊. (2003). 认知动机理论的新近发展——自我决定论. 心理科学, 26(6), 1115-1116."
  ]
}
