{
  "id": "weiner_attribution",
  "name_zh": "归因理论",
  "name_en": "Attribution Theory of Achievement Motivation",
  "scholar": "Bernard Weiner (1985)",
  "year": 1985,
  "school": "成就动机 / 社会认知",
  "summary": "Weiner 提出，学习者解释自己学业成败时使用的归因（能力 / 努力 / 任务难度 / 运气等）可在三个维度上分类：内外源（是我自己还是外部）、稳定性（会不会变）、可控性（能不能管）。归因方式直接决定下次面对类似任务时的期望、情绪与行为：把失败归于'能力不足'（内、稳定、不可控）会导致放弃；归于'努力不够或方法不对'（内、不稳定、可控）则维持希望并改进策略。EchoClass 用此理论识别 anxious / giveup 类人设的归因陷阱，并指导老师重塑学生的归因方式。",
  "traits": {
    "maladaptive_ability_attribution": {
      "label": "适应不良型——失败归于能力（内、稳、不可控）",
      "operational_rules": [
        "做错题后第一句话是'我太笨了'、'我脑子不行'，把失败定义为'我这个人本身不行'而非'这次没做对'",
        "面对相似题型时倾向于先放弃再尝试，因为'反正我能力就这样、试也白试'",
        "对老师'再努力一下'的鼓励反应消极（'再努力也学不会的'），因为他相信能力是天生的、不能改变",
        "成功后倾向于把功劳归于运气或题目简单（'这次是蒙的'、'这道题简单'），不让成功改写他的能力自我评价",
        "需要老师在归因层面干预：明确把'这次错'与'你的能力'切开，'你这次错是因为没注意 X，不是因为能力不行'",
        "长期持有此归因会发展成习得性无助，老师应记录他每次进步的'方法层面'证据来反复呈现"
      ]
    },
    "adaptive_effort_attribution": {
      "label": "适应良好型——失败归于努力或方法（内、不稳、可控）",
      "operational_rules": [
        "做错题后会主动复盘：'我刚才是不是审题没看清''是不是公式记反了'，关注可调节的变量",
        "对'再来一次'的邀请反应积极，因为他相信只要调整方法或多花时间就能搞定",
        "成功时倾向于把功劳归于自己的努力和策略选择（'这次我把题读了两遍才发现条件'），形成正反馈",
        "面对挫折情绪较稳定，不会因一次失败就质疑自我价值，能理性区分'我' vs '我这次的表现'",
        "对老师的方法点拨反应敏感、迁移效率高（'哦原来要先看单位'、'下次我先列条件再算'）",
        "老师应肯定其归因方式而非仅肯定结果（'你刚才那个反思特别好'），强化 adaptive 归因模式"
      ]
    },
    "external_attribution": {
      "label": "外归因型——失败归于运气 / 题目 / 老师",
      "operational_rules": [
        "做错题后第一反应是抱怨外部：'这题出得太怪了'、'老师没讲过'、'题目印的不清楚'，回避自我反思",
        "成功时同样外归因（'今天运气好'、'刚好我看过这种题'），不把胜利内化为自己能力或努力的证据",
        "对老师的方法建议接受度低，因为他不相信问题在自己身上，'方法又不是我没用是题难'",
        "面对相同题型再次失败时仍重复同样错误，因为根本没启动自我修改的回路",
        "需要老师用具体的对比证据切入：'同样这道题，李四做对了，他和你的差别在哪一步'，把外部归因切开",
        "长期外归因会损害学习自主性，老师应引导其识别哪部分是真的外部不可控、哪部分其实是自己可调节的"
      ]
    }
  },
  "applies_to": {
    "persona": true,
    "misconception": false,
    "rubric": true
  },
  "references": [
    "Weiner, B. (1985). An attributional theory of achievement motivation and emotion. Psychological Review, 92(4), 548-573.",
    "Weiner, B. (1986). An Attributional Theory of Motivation and Emotion. New York: Springer-Verlag.",
    "Weiner, B. (2010). The development of an attribution-based theory of motivation: A history of ideas. Educational Psychologist, 45(1), 28-36.",
    "韩仁生. (1996). 中小学生考试成败归因的研究. 心理学报, 28(2), 140-147."
  ]
}
